{
  "schema_version": 1,
  "title": "岗位面板",
  "columns": ["tier", "score", "dir", "title", "company_name", "city", "salary_text", "exp", "degree", "last_seen_at", "report_state"],
  "sort": {"by": "score", "desc": true},
  "filters": [],
  "charts": [{"type": "bar", "by": "dir"}, {"type": "bar", "by": "tier"}],
  "page_size": 500,
  "show_unknown_in_main": true
}
